{
  "$schema": "https://json-schema.org/draft/2020-12/schema",
  "$id": "https://cc-gateway.local/schemas/oracle-lab-requirement-v2-migration.schema.json",
  "title": "Oracle Lab Requirement v1 to v2 Migration Metadata",
  "schema_version": "1.0.0",
  "compatibility_policy": "fail_closed_exact_schema",
  "retention_class": "phase_governance_permanent",
  "redaction_policy": "references_and_safe_categories_only",
  "destruction_procedure": "git_revert_after_security_review",
  "type": "array",
  "minItems": 23,
  "maxItems": 23,
  "uniqueItems": true,
  "items": {
    "type": "object",
    "additionalProperties": false,
    "required": ["requirement_id", "reviewer", "phase_owner", "work_package", "introduced_after_phase"],
    "properties": {
      "requirement_id": {
        "enum": [
          "HA-P0-000", "HA-P0-001", "HA-P0-002", "HA-P0-003", "HA-P0-004",
          "HA-P0-005", "HA-P0-006", "HA-P0-007", "HA-P0-008", "HA-P0-009",
          "OL-LEGACY-001", "AV-B1-001", "AV-B2-001", "AV-B3-001", "AV-B4-001",
          "AV-B5-001", "AV-B6-001", "HA-P1-001", "HA-P1-002", "HA-P1-003",
          "HA-P1-004", "HA-P1-005", "HA-P1-006"
        ]
      },
      "reviewer": { "type": "string", "minLength": 1 },
      "phase_owner": { "enum": ["phase_0", "phase_1", "phase_2", "phase_3a", "phase_4"] },
      "work_package": { "type": "null" },
      "introduced_after_phase": { "type": "null" }
    },
    "oneOf": [
      { "properties": { "requirement_id": { "const": "HA-P0-000" }, "reviewer": { "const": "release-evidence-reviewer" }, "phase_owner": { "const": "phase_0" } } },
      { "properties": { "requirement_id": { "const": "HA-P0-001" }, "reviewer": { "const": "requirement-governance-reviewer" }, "phase_owner": { "const": "phase_0" } } },
      { "properties": { "requirement_id": { "const": "HA-P0-002" }, "reviewer": { "const": "normative-document-reviewer" }, "phase_owner": { "const": "phase_0" } } },
      { "properties": { "requirement_id": { "const": "HA-P0-003" }, "reviewer": { "const": "claim-authority-reviewer" }, "phase_owner": { "const": "phase_0" } } },
      { "properties": { "requirement_id": { "const": "HA-P0-004" }, "reviewer": { "const": "baseline-integrity-reviewer" }, "phase_owner": { "const": "phase_0" } } },
      { "properties": { "requirement_id": { "const": "HA-P0-005" }, "reviewer": { "const": "gateway-boundary-security-reviewer" }, "phase_owner": { "const": "phase_0" } } },
      { "properties": { "requirement_id": { "const": "HA-P0-006" }, "reviewer": { "const": "cross-repository-contract-reviewer" }, "phase_owner": { "const": "phase_0" } } },
      { "properties": { "requirement_id": { "const": "HA-P0-007" }, "reviewer": { "const": "harness-security-reviewer" }, "phase_owner": { "const": "phase_0" } } },
      { "properties": { "requirement_id": { "const": "HA-P0-008" }, "reviewer": { "const": "phase-exit-reviewer" }, "phase_owner": { "const": "phase_0" } } },
      { "properties": { "requirement_id": { "const": "HA-P0-009" }, "reviewer": { "const": "compatibility-authority-reviewer" }, "phase_owner": { "const": "phase_2" } } },
      { "properties": { "requirement_id": { "const": "OL-LEGACY-001" }, "reviewer": { "const": "legacy-evidence-reviewer" }, "phase_owner": { "const": "phase_0" } } },
      { "properties": { "requirement_id": { "const": "AV-B1-001" }, "reviewer": { "const": "onboarding-security-reviewer" }, "phase_owner": { "const": "phase_1" } } },
      { "properties": { "requirement_id": { "const": "AV-B2-001" }, "reviewer": { "const": "authorization-security-reviewer" }, "phase_owner": { "const": "phase_1" } } },
      { "properties": { "requirement_id": { "const": "AV-B3-001" }, "reviewer": { "const": "origin-authority-reviewer" }, "phase_owner": { "const": "phase_1" } } },
      { "properties": { "requirement_id": { "const": "AV-B4-001" }, "reviewer": { "const": "egress-boundary-reviewer" }, "phase_owner": { "const": "phase_4" } } },
      { "properties": { "requirement_id": { "const": "AV-B5-001" }, "reviewer": { "const": "sidecar-authentication-reviewer" }, "phase_owner": { "const": "phase_4" } } },
      { "properties": { "requirement_id": { "const": "AV-B6-001" }, "reviewer": { "const": "destination-policy-reviewer" }, "phase_owner": { "const": "phase_4" } } },
      { "properties": { "requirement_id": { "const": "HA-P1-001" }, "reviewer": { "const": "oracle-evidence-reviewer" }, "phase_owner": { "const": "phase_3a" } } },
      { "properties": { "requirement_id": { "const": "HA-P1-002" }, "reviewer": { "const": "convergence-method-reviewer" }, "phase_owner": { "const": "phase_3a" } } },
      { "properties": { "requirement_id": { "const": "HA-P1-003" }, "reviewer": { "const": "error-classification-reviewer" }, "phase_owner": { "const": "phase_3a" } } },
      { "properties": { "requirement_id": { "const": "HA-P1-004" }, "reviewer": { "const": "transport-contract-reviewer" }, "phase_owner": { "const": "phase_4" } } },
      { "properties": { "requirement_id": { "const": "HA-P1-005" }, "reviewer": { "const": "lifecycle-resilience-reviewer" }, "phase_owner": { "const": "phase_4" } } },
      { "properties": { "requirement_id": { "const": "HA-P1-006" }, "reviewer": { "const": "authorization-matrix-reviewer" }, "phase_owner": { "const": "phase_4" } } }
    ]
  }
}
