[
  { "requirement_id": "HA-P0-000", "reviewer": "release-evidence-reviewer", "phase_owner": "phase_0", "work_package": null, "introduced_after_phase": null },
  { "requirement_id": "HA-P0-001", "reviewer": "requirement-governance-reviewer", "phase_owner": "phase_0", "work_package": null, "introduced_after_phase": null },
  { "requirement_id": "HA-P0-002", "reviewer": "normative-document-reviewer", "phase_owner": "phase_0", "work_package": null, "introduced_after_phase": null },
  { "requirement_id": "HA-P0-003", "reviewer": "claim-authority-reviewer", "phase_owner": "phase_0", "work_package": null, "introduced_after_phase": null },
  { "requirement_id": "HA-P0-004", "reviewer": "baseline-integrity-reviewer", "phase_owner": "phase_0", "work_package": null, "introduced_after_phase": null },
  { "requirement_id": "HA-P0-005", "reviewer": "gateway-boundary-security-reviewer", "phase_owner": "phase_0", "work_package": null, "introduced_after_phase": null },
  { "requirement_id": "HA-P0-006", "reviewer": "cross-repository-contract-reviewer", "phase_owner": "phase_0", "work_package": null, "introduced_after_phase": null },
  { "requirement_id": "HA-P0-007", "reviewer": "harness-security-reviewer", "phase_owner": "phase_0", "work_package": null, "introduced_after_phase": null },
  { "requirement_id": "HA-P0-008", "reviewer": "phase-exit-reviewer", "phase_owner": "phase_0", "work_package": null, "introduced_after_phase": null },
  { "requirement_id": "HA-P0-009", "reviewer": "compatibility-authority-reviewer", "phase_owner": "phase_2", "work_package": null, "introduced_after_phase": null },
  { "requirement_id": "OL-LEGACY-001", "reviewer": "legacy-evidence-reviewer", "phase_owner": "phase_0", "work_package": null, "introduced_after_phase": null },
  { "requirement_id": "AV-B1-001", "reviewer": "onboarding-security-reviewer", "phase_owner": "phase_1", "work_package": null, "introduced_after_phase": null },
  { "requirement_id": "AV-B2-001", "reviewer": "authorization-security-reviewer", "phase_owner": "phase_1", "work_package": null, "introduced_after_phase": null },
  { "requirement_id": "AV-B3-001", "reviewer": "origin-authority-reviewer", "phase_owner": "phase_1", "work_package": null, "introduced_after_phase": null },
  { "requirement_id": "AV-B4-001", "reviewer": "egress-boundary-reviewer", "phase_owner": "phase_4", "work_package": null, "introduced_after_phase": null },
  { "requirement_id": "AV-B5-001", "reviewer": "sidecar-authentication-reviewer", "phase_owner": "phase_4", "work_package": null, "introduced_after_phase": null },
  { "requirement_id": "AV-B6-001", "reviewer": "destination-policy-reviewer", "phase_owner": "phase_4", "work_package": null, "introduced_after_phase": null },
  { "requirement_id": "HA-P1-001", "reviewer": "oracle-evidence-reviewer", "phase_owner": "phase_3a", "work_package": null, "introduced_after_phase": null },
  { "requirement_id": "HA-P1-002", "reviewer": "convergence-method-reviewer", "phase_owner": "phase_3a", "work_package": null, "introduced_after_phase": null },
  { "requirement_id": "HA-P1-003", "reviewer": "error-classification-reviewer", "phase_owner": "phase_3a", "work_package": null, "introduced_after_phase": null },
  { "requirement_id": "HA-P1-004", "reviewer": "transport-contract-reviewer", "phase_owner": "phase_4", "work_package": null, "introduced_after_phase": null },
  { "requirement_id": "HA-P1-005", "reviewer": "lifecycle-resilience-reviewer", "phase_owner": "phase_4", "work_package": null, "introduced_after_phase": null },
  { "requirement_id": "HA-P1-006", "reviewer": "authorization-matrix-reviewer", "phase_owner": "phase_4", "work_package": null, "introduced_after_phase": null }
]
